<!-- Ejercicio ii 2b-->
<!ELEMENT fichero (ficha+)>
<!ELEMENT ficha (nombre, apellido, direccion*, DUI?,pais,fechaNacimiento)>
<!ELEMENT nombre (#PCDATA)>
<!ATTLIST nombre sexo (masculino|femenino) #REQUIRED>
    	<!ATTLIST nombre edad  CDATA  #IMPLIED>
<!ELEMENT apellido (#PCDATA)>
<!ELEMENT direccion (#PCDATA)>
<!ELEMENT DUI (#PCDATA)>
<!ELEMENT pais (#PCDATA)>
<!ELEMENT fechaNacimiento (#PCDATA)>
<!ELEMENT nacionalidad (#PCDATA)>
<!ELEMENT continente (#PCDATA)>
