<?xml version="1.0" encoding="UTF-8"?>
<!-- ejemplodtd1.xml -->

<?xml-stylesheet type="text/css" href="ejercicio-ii-1b-dtd.css"?>
<!DOCTYPE fichero SYSTEM "ejercicio-ii-2b.dtd">
<fichero>
 <ficha>
  <nombre sexo="femenino" edad="17">Angelina</nombre>
  <apellido>Fernandez</apellido>
  <direccion>c/Ulises, 36</direccion>
  <pais>El Salvador</pais>
  <fechaNacimiento>14/06/1996</fechaNacimiento>
  <peso>180</peso>
  <nacionalidad>Salvadoreña</nacionalidad>
  <continente>Americano</continente>
 </ficha>
</fichero>
